Thanks for the program!,Convenience and Saving time each week.,Moderately Dissapointed,Saving time each week.,"It saves you time on the mundane, so you have time for the fun stuff.","Liked the program, you should continue. I think most people would use it to save time.",Setting my substitutions,Life isn't the same every week. Some times you eat more of some items and less of others. I don't always get the some items every week. I look for items with cash back with walmart and ibotta also which may change my current list.
N/A,It seemed to work very smoothly.,Slightly Disappointed,It’s a reminder of many times I typically get.,"The ability to easily make changes to your picks, so you're in control of what you buy.",I was very happy with it. I don’t think that I would pay extra to have this feature as I am perfectly able to add them myself. But it was definitely a cool feature.,Setting my substitutions,Because my schedule varies. I wouldn’t want to get items delivered if I don’t need them or if my needs for that week change.
N/A,This is a great program.  Love not having to think about my usuals,Moderately Dissapointed,It’s easy for someone who is as busy as me,"The ability to have a ""second you"" that knows what you need.",I have no complaints. The program worked well for me,Suggestions for new products we think your family might like,I’m not always home the same of the week for delivery
No,Items I am most likely to need are already on my list. It’s easy to remove the items I don’t need,Moderately Dissapointed,My list is ready to check and go!,"The ability to easily make changes to your picks, so you're in control of what you buy.",Liked it,Creating and controlling my own Replenishment list,I’m not always ready for every replenished item
Not today.,I wish I was able to modify the replenishment cart prior to using it.,Slightly Disappointed,It helps prevent me from having to search for items I use regularly and catch things I might forget.,"The ability to have a ""second you"" that knows what you need.","As stated, I just wish I had a little more control over the replenishment before implementation in my cart.",Suggestions for how I can save by buying in bulk or switching brands,I’m afraid I would forget about items for delivery; either to remove or add them.
I had a positive experience with the program and hope that it continues in some capacity in the future. Thank you!,I like that all my regular items are already in my cart as I tend to purchase them often.,Moderately Dissapointed,It’s a time saver. I don’t have to search for those items each time I’m reordering. I also can sometimes forget and item so it’s helpful that it’s already in my cart.,"It saves you time on the mundane, so you have time for the fun stuff.","I feel like there could be more items added rather than the few that were there each week. Maybe the customer can choose their own replenishment items to always have in there, with others added by Walmart if they are ordered on a semi regular basis.",Creating and controlling my own Replenishment list,"I don’t typically use the same items at the same time every week. Or if I do, they are used at different rates which would require way too many deliveries."
Was happy with the test program,My every week items already loaded saves me time,Slightly Disappointed,Saved me time,"The ability to easily make changes to your picks, so you're in control of what you buy.",Saved me time,Pre-booked delivery time,My schedule changes and  I need to change delivery times
I would like to know if there will be additional cost to replenishment. Also it’s important to let the customer know the benefits for both the consumer and the seller.,Consistently adding our weekly items.,Moderately Dissapointed,Much easier and a time saver!,"The ability to easily make changes to your picks, so you're in control of what you buy.",I cannot think of anything to add.,Creating and controlling my own Replenishment list,Needs of items can vary depending on the week.
My only real issue is that home delivery uses too many bags. I often receive one item in a plastic bag which is then put into a paper bag with other plastic bags containing one or two items. Either pack the plastic bags full or just put my items in the paper bags. I shouldn’t receive three paper bags with 15 plastic bags containing items. That’s really wasteful and not environmentally friendly.,"It needs further training to get more accurate, either that or my purchasing pattern is just too unpredictable.",No Reaction,"For me, none really. It didn’t speed up the time I spent shopping. Having to remove its selections took more time than picking the items I needed that week.",None of the above,I did not see any benefit.,Other,I don’t always need some items when your computer thinks I do and I don’t want to buy something I don’t need. I use auto delivery for only 2 items from Amazon. I would not want it for my groceries.
N/A,I love that it evaluates it each week and adjusts to my changes.,Very Disappointed,"With my everyday items I used to go through all of my favorites, since I usually don’t write them down. It took awhile and I would miss something. It’s amazing now I don’t have to.","The ability to easily make changes to your picks, so you're in control of what you buy.","I love everything about it. The only challenge was figuring out which day to put for my replenishment. I usually put my order in on Sunday and have it delivered Monday for the week. Now that I have my replenishment picks set for Saturday, it’s all set for me.",Suggestions for how I can save by buying in bulk or switching brands,"I don’t care for autoshipment because it’s not always consistent. Take our milk for example, we drink roughly a gallon and half a week. So some weeks I buy two gallons. And some weeks I buy one. If it were automatic, I would be wasting milk or not having enough."
Walmart provides excellent service and fast delivery.    Having the Walmart plus membership has allowed me to get items from Walmart even though I live 15 to 30 minutes away from the nearest store.,It seems to be working well.,Slightly Disappointed,Replenishment makes things a little bit faster.    I prefer replenishment instead of subscribing to grocery deliveries.    I don’t really like the subscriptions because they come as surprise.,"It saves you time on the mundane, so you have time for the fun stuff.",I think it is working well.    I plan to continue using replenishment.    The suggestions are correct most if not all of the time.,Pre-booked delivery time,I am leery of auto delivery.    I am  OK with having a timeslot reserved automatically for me as long as I can change it. My schedule is stable about half the time.
The replenishment program does have potential as long as there is no auto delivery attached to it.,There were a lot of problems at first with the carts actually loading the replenishments and then getting the right number of items. It would be best to make sure the bugs are better worked out before you do another trial.,Slightly Disappointed,"It’s nice that I don’t have to add everything I would buy each week into the cart. As long as you can edit the cart, the replenishment items are helpful.","The ability to easily make changes to your picks, so you're in control of what you buy.","There were a lot of problems getting the replenishment to work right, which was annoying. Next time you should do more work on ironing out bugs BEFORE you do a trial",Creating and controlling my own Replenishment list,Because I don’t buy groceries exclusively from Walmart. Some weeks other places have better deals so I may buy my weekly groceries from a different store. I do know that if auto delivery was a requirement I would not shop at Walmart.
Pretty happy!,"Makes ordering so easy, saves me tons of time.",Moderately Dissapointed,The time saving and not forgetting essential items,"The ability to have a ""second you"" that knows what you need.",Only thing was sometimes it added 2 of an item I didn't need,Creating and controlling my own Replenishment list,I do change my delivery time often
N/A,"Its very convenient to have all the usual groceries I buy automatically added, it saves a lot of time",Moderately Dissapointed,Saves time!,"It saves you time on the mundane, so you have time for the fun stuff.",If you could pick which items to add to replenishment.  Or pick which day of the week replenishment happens,Creating and controlling my own Replenishment list,"Because I have a busy schedule, so I was to make sure I'm home before I receive orders"
No thank you,Pay more attention to shopping habits,Slightly Disappointed,Just having stuff in my cart already,"The ability to have a ""second you"" that knows what you need.",N/a,Other,There may not always be funds available
I like the program hope it works well for everyone!,The program does a good job of anticipating my replenishment items. Helps me save time!,Very Disappointed,"I’m able to choose a specific day. Plus, it anticipates which items I buy regularly and need to restock","The ability to have a ""second you"" that knows what you need.",I’d like a app notification so I know when to view my cart.,Creating and controlling my own Replenishment list,I might not be home depending on any plans I may have
N/A,I think just providing detailed instructions with screen grabs on where to activate replenishment.  It was a bit clunky and hard for this trial.,Slightly Disappointed,Time saving on receiving weekly staple items,"The ability to easily make changes to your picks, so you're in control of what you buy.","See previous question, the confusion on the process.  It has to be easy and simple to choose and stop replenishment",Pre-booked delivery time,"I could only pick one, this is of course important"
No,No changes. It worked as intended. It was just not for me.,No Reaction,It added items you may of forgotten that you needed in your cart.,"It saves you time on the mundane, so you have time for the fun stuff.","My needs or wants would change weekly. Also my financial situation would vary by week. So I may not get the same items or want the same dinners from the previous week. So it would add items I really did not want for that particular week. Also I would add items to my cart throughout the week as I would think about needing them. Well the problem with replenishment would be that it would also add items and I would find myself having to delete certain things. Replenishment may work for some people, but was not really for me  it was nice having my milk or water added but just did not benefit me enough.",Suggestions for new products we think your family might like,"For me, my financial situation varies so I may only order a few things on a particular week. Other weeks I may order more."
N/A,Very convenient not having to add my commonly purchased items to the cart every week,Moderately Dissapointed,The time saver of not having to add those items to the cart,"It saves you time on the mundane, so you have time for the fun stuff.","I would like to be able to control what items i put on replenishment and add a frequency. So if I don’t purchase it weekly I could set it to add every 2 weeks, etc.",Creating and controlling my own Replenishment list,I like to control what day I get delivery
I really enjoyed the replenishment program.,Sometimes I the The quantities are a little off. It adds  more than I ever really order and I often forget to check the quantity before checking out.,Slightly Disappointed,It remains me of items I am running low on.,"The ability to have a ""second you"" that knows what you need.",A way to change what day the replenishment showed up in my cart. And maybe a reminder to check the quantities before I check out,Creating and controlling my own Replenishment list,"I like to make sure if I really need that item or not, and if it fits my budget for the week."
"no, thank you for this opportunity!","It was oddly timed - usually I'd get my replenishment notifications just after I'd already placed an order, so it wasn't super helpful.",No Reaction,not having to go through past orders to see what I might be running low on,"The ability to easily make changes to your picks, so you're in control of what you buy.",n/a,Creating and controlling my own Replenishment list,b/c many times I had already ordered groceries & then within a day or two be notified my replenishment picks were available in my cart - like it was almost always a day or two late
N/A,I think the algorithm is a little bit off. It often recommends multiple versions of the same thing (like bottled water) so I end up with double. There are also things I order frequently that don’t show up at all.,Slightly Disappointed,Saving time and you don’t forget things,"It saves you time on the mundane, so you have time for the fun stuff.",Recommendations on cost saving similar items might be good!,Suggestions for how I can save by buying in bulk or switching brands,I like control so I don’t waste money
I really liked how the research team seemed so responsive to the data and feedback they were getting. I hope this can become a feature going forward online. It was really nice not having to add my most common items each week.,"The only drawback of Replenishment was if I ordered something a few times, but didn't need it on repeat, it kept being auto added to my cart. I know you can go edit the items somewhere, but it requires another step. The algorithm wouldn't know this though.",Slightly Disappointed,It saved me time having to add all of my usual items to my cart.,"The ability to have a ""second you"" that knows what you need.",It would be neat if the auto added items had a comment about price (ie this item is cheaper than last week so be sure to buy now!).,Suggestions for how I can save by buying in bulk or switching brands,I like being in control of when the items (particularly grocery cold items) are delivered as my schedule changes week to week.
"Thanks for choosing me to be a part of this trial! Even though the service as it currently stands isn’t a good fit for me, I appreciate that you take the time to check in with your customers to try to provide something helpful!","When I first started using this, it seemed okay, maybe even a little helpful. After all, I love Walmart+, particularly the In Home delivery service.     However, after dealing with Replenishment for months now, I cannot wait for the trial to be over so I can turn it off. It’s pushy and irritating; its picks are the opposite of helpful. It wants me to order things that I purchased literally the day before and doesn’t remember things that I haven’t purchased in weeks and may actually need to restock. The whole thing is just another chore for me — to go in weekly and delete all the unnecessary items it puts in my cart.     My take on this so-called “service” is that it’s a useless AI tool that no one asked for and no one will benefit from. It adds zero value for me as a customer and I can’t imagine that I would ever want to use it again.",No Reaction,"I wanted to find one, but I just couldn’t. It didn’t actually help me at all, and was in fact a hindrance. I dreaded replenishment day because I knew I’d open the app to a cart full of things I didn’t need that week and it kind of stressed me out.","The ability to easily make changes to your picks, so you're in control of what you buy.","I think I would like this service if, instead of automatically adding things to my cart, it provided a page that listed everything I’ve bought in the last month or two. That way I would be in control of what went in the cart and what should wait until next week, and it would help me remember things that are regular purchases but not as frequent as replenishment wanted to make them.     Honestly, it’s the automatic adding-to-cart that I really didn’t like. I tend to use my cart as my weekly shopping list, adding items I’ll need as I think of them. Replenishment sort of threw off that whole routine for me and made shopping with Walmart more difficult instead of easier.",Creating and controlling my own Replenishment list,"I would ABSOLUTELY NOT want auto delivery. The selections are nowhere near accurate enough, it would greatly increase my weekly spending beyond my budget, and the amount of food waste we would have piling up would be disgusting. Auto delivery would be enough to make me withdraw from the Walmart+ program altogether, and it’s currently my favorite subscription service that we have."
No!,Let the customer pick a replenishment day. I don’t always do my shopping on Fridays.,No Reaction,Don’t need to go shopping individually for each itsm,"The ability to easily make changes to your picks, so you're in control of what you buy.",No comments,Creating and controlling my own Replenishment list,I want control over which items I need. I shop a few times a week so I don’t need every item every time. So the number of items change.
N/A,"It did what it was supposed to do. I just found for myself that what I order changes enough each week that I had to go through and make enough changes to the replenishment list that it felt like for me at least, replenishment wasn’t as helpful as I had hoped it would be.",No Reaction,I didn’t find a huge benefit to Replenishment.,None of the above,"I think it does what it is supposed to do, and people who basically buy the same staple foods each week will be helped by it.",Creating and controlling my own Replenishment list,Because then I might automatically have groceries delivered that I don’t need that week.
I like the in home delivery would be nice if replenishment is as efficient,Better recommendations,No Reaction,Easy add for items,"It saves you time on the mundane, so you have time for the fun stuff.",Maybe if it can detect how often I order things and recommend them,Creating and controlling my own Replenishment list,What if I don’t need it
N/A,It’s out of our control but making sure we get the items before they are out of stock.,No Reaction,Saves times and money! That’s a no brainer for someone as busy as I am,"It saves you time on the mundane, so you have time for the fun stuff.","It was an addition to how great Walmart is, and is continuing to make things easier for their customers",Pre-booked delivery time,"I don’t always need the same items every week,"
"All in all, I think this program has been helpful and would continue to use it, if it was still being offered.","There were several glitches at first, but the past few weeks, replenishment has worked well.",Slightly Disappointed,"It is nice/ convenient to have items added to my cart, that I might otherwise forget to add. It also saved me time by having the items in my cart already for me to check out.","The ability to have a ""second you"" that knows what you need.",I think it would be helpful to also have replenish set up to be delivered on a certain day/timeframe so you would only need to go in and add things or change things the night before it was set to be delivered.,Automatic delivery of my Replenishment items,N/A
"This was an interesting experience. I’m so thankful Walmart is taking customer’s feedback into consideration. It can be quite challenging to provide feedback after a program is implemented because no one ever seems to know how to direct you to the powers that be, so having a say beforehand makes me feel like Walmart cares about a customer’s experience.","It would be nice to have an on/off option (maybe even ‘snooze’) for replenishment items. It could just be our household, but I find the system continues to suggest replenishment for items I’ve intentionally not purchased in a while.    It would also be awesome if replenishment items were not suggested if they are out of stock. That was a bit frustrating on a few occasions.",No Reaction,"The main benefit is not having to waste time searching for, then adding items to my cart. It’s easier to remove a replenishment item than it is to search for the right item to be added.","The ability to easily make changes to your picks, so you're in control of what you buy.","1. Allow customers to set up automatic reorders for frequently purchased items on a schedule that suits their needs.    2. Provide real-time stock updates to ensure customers know what items are available before placing orders. At a minimum, don’t suggest replenishment on out of stock items.    3. Notify customers when their favorite products are back in stock, when prices drop, or when it's time to reorder specific items.    4. Offering subscription plans for regular delivery of essential items like milk, bread, or cleaning supplies would be helpful as those are the basics that we can easily & confidently predict a need for.",Creating and controlling my own Replenishment list,"Our family’s needs are ever changing, so I prefer to be more in control of when items are delivered to prevent waste. However, my exception to this would be auto delivery of home essentials like milk, bread, etc."
Please make a way to save one store as your preferred store instead of defaulting to closest store.,It works fine. Not sure what could be improved.,Moderately Dissapointed,Made checking out easier and faster.,"The ability to have a ""second you"" that knows what you need.",I liked that it saved time on ordering. It made a list of the items I used most. Not sure what could be added but it did help.,Setting my substitutions,I like to be in control of when a delivery happens. And the app doesn’t default to my favorite store I have to manually change it.
N/A,"It helps me from forgetting any item that I usually buy. If I choose not to purchase it at that time, I can delete it and know it will come back on my next order. It makes my shopping more accurate.",Moderately Dissapointed,"Mainly, it keeps you from forgetting something. AtI my age that’s important. It’s better than scrolling through the “my items “Section. When you have to limit yourself to an exact dollar number with your grocery shopping It makes it easier.","The ability to have a ""second you"" that knows what you need.","No issues, I like the program.",Creating and controlling my own Replenishment list,"I use my grocery list at Walmart as a kind of regular grocery list. If I remember something, I go ahead and put it in my basket at Walmart. I can only purchase groceries at certain times because of my Social Security and having to be very careful about the amount I spend. I usually have two set time in -home deliveries a month with maybe an extra one. One delivery date is totally dependent on my Social Security check coming in and then there’s Scheduling deliveries that  don’t conflict with my Appointments."
Thank you for allowing me the opportunity to participate in this. It was unique!,It kept me from forgetting items.,Slightly Disappointed,It’s a good reminder of items we enjoy most. It’s a win-win for both Walmart and the consumer. Walmart makes consistent sales and the consumer receives the joy of having items they obviously enjoy.,"The ability to easily make changes to your picks, so you're in control of what you buy.",Ensure there is a renewal process for replenishment items we may pass on initially.,Creating and controlling my own Replenishment list,Though good for Walmart (profits) the consumer may not need the extra items at that time.
No,Ordering groceries is so much easier and faster since the essentials have already been added to my cart.,Moderately Dissapointed,It is so much faster and easier.it keeps me from forgetting essential stuff or items that are running low.,"The ability to easily make changes to your picks, so you're in control of what you buy.",I really enjoyed that replenishment knew exactly what I needed and the amount.,Setting my substitutions,I have a constantly changing schedule and am frequently out of town. I would be worried deliveries would come when I wasn’t at home.
"No, I think the program was great! I’m glad I was able to be part of it","I liked having my usual items automatically added to the cart, and it was easy to adjust for items I didn’t need or needed more of. I would definitely like to see this program continue!",Very Disappointed,It saves time and helps me not forget our usuals,"It saves you time on the mundane, so you have time for the fun stuff.",I thought everything was great!,Creating and controlling my own Replenishment list,"I would be afraid I would forget to adjust the items on the order and would end up purchasing things I did not need. Also, in the event that we are out of town, we would be wasting money. I think being able to schedule my own deliveries is ideal."
N/A,I want to pick the day I get my replenishments.,Moderately Dissapointed,Saves time on remembering what I need each week.,"The ability to have a ""second you"" that knows what you need.","I would like to pick the day it happens. Also I would like it to pick up on on frequently I make a purchase, so if I purchase something once a month it will add it once a month to my replenishment cart.",Suggestions for how I can save by buying in bulk or switching brands,I want to be the one to control when it is delivered and paid for.
