Overall I enjoyed these couple of months of not having to think about what to add to my shopping cart. Great initiative!,"Try to keep track of the quantity of each item being purchased and added as a replenishment pick. For example, the number of bananas added to my cart never matched the right number I purchased every week.",Slightly Disappointed,Time saver and it also helps to remind me of some items I would have otherwise forgotten to order,"The ability to easily make changes to your picks, so you're in control of what you buy.",It is a very good concept for busy and forgetful people. I enjoyed going to my cart every week and seeing my replenishment picks. The only improvement I can think of is finding a way to add the correct quantity to each item,Creating and controlling my own Replenishment list,"I wouldn’t say it would not improve my experience. I would like to have an option of auto delivery but only if it is customizable in a way that it  can work around my schedule.    I would do it if it includes an option to cancel any specific week’s auto delivery, for example if that week I won’t be home or didn’t get through all our food before."
Nothing,I like the fact that the items are already in my cart.  It is easier to remove items than it is to remember to add them.,Moderately Dissapointed,Time saver!!!!,"The ability to easily make changes to your picks, so you're in control of what you buy.",N/A,Suggestions for how I can save by buying in bulk or switching brands,I still want to be in control of when items are delivered and the day/time could change each week.
N/A,I think there should be an option to click when we want to replenish,Moderately Dissapointed,Saves time instead of having to scroll through all favorite items,"It saves you time on the mundane, so you have time for the fun stuff.",I liked not having to scroll and look for the things I normally buy. Saves time.,Other,"Some of the replenish items that were not needed, and I would not want to over buy anything that I don’t need"
Keep up the good work.,Better AI.,Slightly Disappointed,Convenience.,"The ability to easily make changes to your picks, so you're in control of what you buy.",No suggestions.,Suggestions for how I can save by buying in bulk or switching brands,Too much variation from order to order.
N/A,The items chosen weren’t weekly purchases. I’d like to choose the replenishment dat,No Reaction,None,None of the above,It seems to be redundant with My Items,Creating and controlling my own Replenishment list,Too many changes based on week
N/A,I would like to be able to pick my day of the week that Replenishment shows up in my cart,Moderately Dissapointed,Saves me time! I buy some things every week and I like replenishment adds them to the cart for me.,"It saves you time on the mundane, so you have time for the fun stuff.","I do think it got plenty we as time went on, at first it suggested things I sometimes buy and didn't replenish things I buy every week. But I felt like by the end it figured it out more.",Creating and controlling my own Replenishment list,"I like to control when delivery happens, so I can prepare for it or make sure I'm home. So I like to schedule my own deliveries."
N/A,"Place more items in cart. If I do not need them, I could unselect them.",Moderately Dissapointed,Saves time and serves as a reminder.,"The ability to have a ""second you"" that knows what you need.",The feature is great! I really enjoyed it.,Setting my substitutions,My personal needs change from week to week.
Keep making improvements to make life easier!,I loved opening the app and my main staple item were already in the cart. It made it easy to save for later (if i didn't need them OR order them).,Moderately Dissapointed,"It is easy that all my main items are in my cart, makes it easier for me to continue my shopping and add other items. It saves time as well.","The ability to have a ""second you"" that knows what you need.","I do not have anything that i can suggest. I thought it was perfect.  I will say, my cart will be more consistent once school starts.  This summer we had vacations, two separate families staying with us, so we were not super consistent with our replenishment.",Suggestions for how I can save by buying in bulk or switching brands,"We like to travel, so i like to ensure we are home for delivery and will eat the food purchases.  and with auto delivery i don't want to order anything extra or not be home when we are going out of town."
No,Makes it easier and saves time!,Moderately Dissapointed,Saves time,"It saves you time on the mundane, so you have time for the fun stuff.",Just needs to keep up and adjust when we stop using a product,Pairing recipes with product suggestions,I need to edit what I do & don't need that week
"No,  I have nothing more to add.  Thank you.",I think that you need to rely less on the last order and more on what the last month of orders has been.  This would make the replenishment process more effective in my opinion.,Moderately Dissapointed,My cart has most of the items that I need already in my cart and I can easily add any additional items or adjust amounts on my regularly purchased items.  I have really liked the program overall.,"The ability to have a ""second you"" that knows what you need.",I have covered the one thing that I think was an issue for me and that is relying on the most current order instead of an average of the orders over a period of time.,Suggestions for new products we think your family might like,It would improve my experience.  It would just need to be easy to change if needed.
Keep up the great work!,I love having a more limited list to initially go through while I plan out or weekly groceries.  It saves me time and I can easily remove items I don't happen to need that week while then adding any new ones.   I enjoy the process of our weekly grocery order through Walmart online and this just makes is better.,Very Disappointed,Ease of access for my most common repeat items.   I no longer have to look for them among the list of all the items I've purchased before.,"It saves you time on the mundane, so you have time for the fun stuff.","I just hope it continues, it is beneficial and I like using it!",Suggestions for how I can save by buying in bulk or switching brands,"Things sometimes change week to week, so I'm not a fan of auto-delivery."
N/A,I didn’t have to go and look for a lot of the items that I buy weekly. It made grocery shopping more efficient.,Very Disappointed,Saving time,"The ability to easily make changes to your picks, so you're in control of what you buy.",Add more items that the shopper can delete if need be,Suggestions for new products we think your family might like,I don’t want any type of delivery or purchase made without my prior approval
"I love having WM Plus, makes my life so much better. Wish this was around when my husband was deploying and I had to grocery shop on my lunch break or with small children.",I liked getting a list each week of my regular items. Kinda reminds me of my Amazon Subscribe and Save,Very Disappointed,"Reminders are so helpful, saves me from going to the grocery store or initiating another delivery","The ability to have a ""second you"" that knows what you need.",Loved the second chance to add things to my weekly order. I wish I could link my meal plan to my cart so it adds all the things I need for the week. And I wish the delivery window was smaller.,Pairing recipes with product suggestions,"Sometimes we don’t go through our regular items as quickly, ie milk, bread etc"
That is it,More frequent updates,Moderately Dissapointed,Time savings,"The ability to have a ""second you"" that knows what you need.",Ability to customize replenishments instead,Creating and controlling my own Replenishment list,Life is uncertain
No,Option to change day  and replenish early. some weeks I want to order groceries early,No Reaction,Slightly faster for shopping,"The ability to have a ""second you"" that knows what you need.",“Replenish now” button if I want to replenish early,Creating and controlling my own Replenishment list,My needs change from week to week
N/A,Better tracking of goods,Moderately Dissapointed,Adding certain things and easy removal,"The ability to easily make changes to your picks, so you're in control of what you buy.",Not much,Creating and controlling my own Replenishment list,Quantity doesn’t match
N/A,Allow me to manually replenish my cart on demand.,No Reaction,It saves time from having to manually choose all my regularly purchased products,"It saves you time on the mundane, so you have time for the fun stuff.",The only feature that I think should be added is a manual way to replenish your cart instead of waiting for the scheduled replenish days.,Creating and controlling my own Replenishment list,I dont always need the products added to my cart
N/A,Nothing really. I just didn’t find the concept super helpful.,No Reaction,It can make shopping faster and make it require less mental energy,"It saves you time on the mundane, so you have time for the fun stuff.",No comment,Creating and controlling my own Replenishment list,I wsnt control over that
I think it could be a great service for working families!,I do not believe you could do anything,No Reaction,None. I think it may be great for working families.,None of the above,I like to pick my own items. I believe this could be helpful for working families. I would have loved this 20 years ago. I am retired now.,Creating and controlling my own Replenishment list,"Yes, I am retired and like to change things up, and may not need certain items weekly."
I rarely shopped at Walmart before in home. Not it is my exclusive grocery store.,This saved me so much time when ordering my most often purchased items. I always knew it would be there on Tuesday so I waited for that before I built my order.,Very Disappointed,Time savings and a reminder about what to purchase.,"It saves you time on the mundane, so you have time for the fun stuff.",This is a wonderful service.,Pre-booked delivery time,I had to occasionally alter my list so I want time to do that and don’t feel that could be possible with auto delivery.
No,allowing us to in put when we are on vacation so that its clearer,No Reaction,I can check those items if we need to restock them,"The ability to easily make changes to your picks, so you're in control of what you buy.",Frequency.,Creating and controlling my own Replenishment list,Becuase I may be on vacation and I like control when I have items come and the environment
Good job coming up with new innovations!,I think it would be better if it put the suggested items in your cart but then there would be another step to accept them. A couple times I got stuff I just didn’t notice and really didn’t need.,No Reaction,"One less step when adding things to my cart. Easy enough to take them off, but saves time in adding them.","The ability to have a ""second you"" that knows what you need.",No other comments,Creating and controlling my own Replenishment list,I definitely wouldn’t want things to be delivered automatically in case I forgot to check it beforehand. I’m sure it would cause many unnecessary returns.
Thank you for the opportunity to try this feature trutl its great but interesting text or more alert options would connect to having auto delivery with replenishment more comfortable and with the confidence of controlling your list,"Possible access to a list to adjust the auto-replenishment items if no longer using or purchasing, this could aid in having a better auto subscription advantage",Slightly Disappointed,It already helps me get my list started and see what i truly need or not and plan for weekly meals,"The ability to easily make changes to your picks, so you're in control of what you buy.",A text message alert would be great! More real time and to complete purchase within timely manner,Creating and controlling my own Replenishment list,It would improve I just believe having control is a bit more important and also having text reminders this would aid in getting auto delivery correct with no unneeded items abd aware of costs and expectations of time of arrival
"No, thank you.",You fixed most of the problems that occurred in the beginning weeks of the program. Since then things have worked pretty well.,No Reaction,Faster filling of my cart.,"The ability to easily make changes to your picks, so you're in control of what you buy.",Having the possibility of a every other week replenishment.,Automatic delivery of my Replenishment items,N/A
"I love the Walmart Plus program overall, specially the In-Home feature without the tips and dedicated delivery person.      Not related to Replenishment, but I would love to see more enhancements on the substitution feature:    Right now I have to remember every time to disable substitution if I don’t want other choices (or haven’t seen a way to do it permanently).  Otherwise, if I forget, the substitutions may not be what I would’ve picked.      Ideally, I would have substitutions disabled globally and then only enable it for the items I may consider other choices.  Moreover, I would like to have the ability to fine-tune a substitution with an entire set of items.  For example, right now if I have a gallon of milk in my cart, my only substitution preferences are a different brand of milk or a half-gallon of the same brand.  Ideally, I want two half-gallons of the same brand, but I can’t do that, so I’d rather not pick a substitution.  And if I can save this for each item, then it would be even better :-)",Fine tune frequency of items getting added.,Slightly Disappointed,"Pre populated cart, it’s easier to review and remove items if not needed than going out and finding them individually","It saves you time on the mundane, so you have time for the fun stuff.",I like that the items are labeled with the “replenishment” tag because I’m constantly modifying my cart so it’s good to know which ones were automatically added.,Creating and controlling my own Replenishment list,"I would love to have auto delivery for non-perishable items but I would like to see patterns, like amount and frequency, of some staples to convince myself to commit to an auto-delivery.  Recommending items because I’ve bought them “previously"" or “regularly"" is not enough, for me, to select auto-delivery.  Maybe this can be a hidden or advanced option.  I would love to see my purchase history by individual items, with price and quantity. This information would be very valuable to make future purchases."
"No...love Walmart, Walmart+, and appreciate the hard-working employees who are always helpful when shopping inside the store and the employees who deliver our groceries.","Easy to use; love filling up our cart and ""saving"" other items.  It's always easy to search for a particular item and either add it to the cart or have it shipped.",Very Disappointed,"Almost all of our items that we use regularly are available to us (almost always).  We still have other links to get to items that are ""in season"", which makes it easy to find those items and add them to our cart.","The ability to easily make changes to your picks, so you're in control of what you buy.",I like saving items for the once a week groceries; sometimes it helps to get the items back into the cart or as an item we forgot we needed.  I still like having our lists (especially at holiday times) where we buy specific items for special meals.,Pre-booked delivery time,"We love auto delivery with Walmart plus, and deliveries are always within our selected time frame / day for deliveries."
"The biggest issue I have with walmart is the other vendors they have listed - I would like to be able to choose Walmart products only and have that option stick.  That would be the biggest thing you can do to make the shopping experience better. I want to purchase from walmart, not their third party vendors.    Additionally, I'm pretty frustrated with the at home addition to my account due to the fact that they so often deliver expired or yucky produce and the only way for me to get money back is to take it back to the store.  I originally signed up for in home because they did return pickups, but I have not had that option in a long time and it's not there most of the time.  (Once within the last month ""by accident"" per the person who called to cancel the pick up.)  Having to take back bad products that are damaged or expired makes the delivery moot because i still have to go to the store.","Not really anything - It's nice to have items added directly to your cart, but it's hard to guess how often we would need it I think.",No Reaction,Just not having to search for items to add - but you can find them in your reorder list too.,"The ability to easily make changes to your picks, so you're in control of what you buy.","I think its a nice extra, but I would not pay a separate fee for it.  I do like that it lets you make changes and confirm.",Creating and controlling my own Replenishment list,I'm never positive week to week how much of one item I would use - especially items that expire like cheese - I would end up with too much if they automatically delivered.
N/A,"I think the idea of auto-replenishment is good in theory but I found that I only used maybe 25% of the replenishment picks each week. For various reasons, I did not need the items when they showed up in my cart. Sometimes it was because I had gone to the store over the weekend and purchased a few of the items that were auto replenishment picks but they showed up anyway. And, sometimes it would add 2 of an item but I rarely purchased more than one. One time I didn't see that more than one had been added and ended up with two big trays of chicken, 4 pounds of strawberries and two bags of cucumbers. This is a problem with fresh food as it can go bad before I can eat it. To make this better, I would (1) remove auto picks if the item was purchased within the last few days. (2) only add one of an item OR make it very obvious that two or more were added  like the yellow banner below an auto pick",No Reaction,It starts off your cart with your usual items. Saves time from having to go find them individually and remember them as well,"The ability to have a ""second you"" that knows what you need.","The idea of having a list of weekly picks is good, but I don't always need them. I think an automatically curated list of replenishment picks would be a good alternative. There could be a link in the cart screen that takes you to your picks. Then you can just scroll through the list and tap ""add item"" for each one that you need. This would accomplish the same goal and save time as well without having to go through and remove unwanted picks.",Other,I don't always need the picks. I would end up with items I don't need.
no,Better amount picking,Slightly Disappointed,"Easy to modify list, saves time","The ability to easily make changes to your picks, so you're in control of what you buy.",overall made the process easier,Suggestions for new products we think your family might like,like control over ordering as needs vary
Great job,Saves time and knows my usuals,Moderately Dissapointed,Saving time,"It saves you time on the mundane, so you have time for the fun stuff.",Loved this trial,Suggestions for new products we think your family might like,Don’t always need the same stuff
No,I don’t think there is anything to improve. It just did not work for me.,No Reaction,No benefit for me.,None of the above,It just wasn’t for me.,Creating and controlling my own Replenishment list,I don’t always order the same product
The emails that I got could have been a little more detailed as far as being more easily identifiable. More Walmart branding so they didn’t seem like a scam.,"Some of the items in my cart I did not need but forgot to take them out. There is probably a way to adjust that but I didn’t know how. For example, I had bread and milk Ho to waste because I didn’t need them as often as they were in my cart.",Slightly Disappointed,Not having to search for the items.,"It saves you time on the mundane, so you have time for the fun stuff.",Just needed more guidance of the timing the things were added. But I like doing this instead of subscribing to items.,Creating and controlling my own Replenishment list,I don’t need certain things at all times. I don’t like subscribing because my income changes
N/A,The program got better as time went on. It is hard when we place 2 orders a week because sometimes we order early and then it adds the same items we just ordered to the cart again. So then I have to go remove them. It should look at the last time I ordered something,No Reaction,"Not really anything. I think the thing that says did you want to add … to your cart is more helpful than if you just add it. If you add it then I have to remove it if I don’t want it, which is harder",None of the above,See other comments,Setting my substitutions,Sometimes we want a different day.
No,"You need to give your customers the ability to ‘sort’ the replenishment list. It is difficult to walk through your home areas and have to keep trying to find the items on your list that seems to be sorted by the location in the store or?  If customers could sort the list in the order that they check the items in their home, it would be a real time saver and powerful tool.",Slightly Disappointed,"I used to load previous purchases, in their entirety, to my cart and adjust the items accordingly based on my current needs.  The Replenishment does save that time and if it can add items that are purchased bi-weekly, monthly, etc., it would be even better.","The ability to easily make changes to your picks, so you're in control of what you buy.",I have nothing more to add at this time.  Thank You,Creating and controlling my own Replenishment list,There are to many variables in items ordered
I really appreciate you creating this type of service to meet the needs of the customers. It’s one of the reasons I’ve become a Walmart shopper almost exclusively!,"I love not having to think about putting my weekly grocery needs in my cart. I also love that it adapts the amounts to my needs based on what I’ve ordered the previous weeks. For instance, if I had been increasing the quantities, it factored that in and vice versa.",Very Disappointed,"Time saving and not having to worry about forgetting my essential items! Like milk, bananas and bread :)","It saves you time on the mundane, so you have time for the fun stuff.",I’m not sure if this is something that’s available (I could’ve missed it) but I’d like to be able to add things to my replenishment picks for weekly items. I only saw the subscription option and that’s really only for items I want delivered. Hopefully that can be added or made more prominent.,Creating and controlling my own Replenishment list,Not really sure of what this would mean and it sounds like it would add more money to my final bill. I’m really trying to cut down spending.
Thank you for letting me try this.,While we had teething issues early on the ease of use and volume of picks as the program has grown has become incredibly useful for us. Saves a significant amount of time on the weekly shop,Moderately Dissapointed,Time saved.     I find navigating the site for individual items either by search of by favourites quite cumbersome. This makes the process much simpler.,"The ability to easily make changes to your picks, so you're in control of what you buy.","The ability set ""replenishment"" parameters for items could be something to look into. Like a max limit.    Example, we would set milk to add every week, but maybe set cat food to max monthly.",Creating and controlling my own Replenishment list,We can be slow to review and update. I would prefer to avoid two deliveries if we are slow on the shop. Less hassle for everyone.
N/A,The convenience of having items I buy regularly automatically added to my cart making sure that I don’t forget to get those essentials.,Very Disappointed,Having essentials ready in my cart,"The ability to have a ""second you"" that knows what you need.","It would be great if the program evolved into adding all the items needed for a recipe. For example, being able to make dietary selections/preferences and have the system add ingredients for meals, along with preparation instructions.",Suggestions for how I can save by buying in bulk or switching brands,Automatic delivery would take away my ability to control what I need that week in case of changes.
