Post Survey Comments,Product Satisfaction,PMF Rating,Primary Replenishment Benefit,Select Top Benefit Replenishment,General Feedback,Experience Improvement,Why does Auto Deliver Hinder Experience
"I was so excited to get the email asking if I’d like to be part of this pilot. I am a long time Walmart+ member and Walmart is the only grocery store I purchase from. I was expecting the $150 gift card on June 28th after the 8 weeks of the pilot, per the sign up email. That day came and went, multiple calls to Walmart and multiple emails sent asking for the gift card with no help from anyone. I ended up speaking to 12 representatives, none of which knew what Replenishment was. I would highly suggest informing employees of pilots like this and have an easier way to get in touch with someone when customers have issues/questions. There needs to be a better process for sure.","If you already have a specific item in your cart, replenishment shouldn’t add another one. I didn’t realize this and ended up with two half gallons of milk.",No Reaction,It helps you get everything you normally would. Lessens forgetting items.,"It saves you time on the mundane, so you have time for the fun stuff.",I think you should be able to pick which day of the week replenishment items are added to your cart.,Suggestions for new products we think your family might like,Items I need sometimes change week to week. I don’t want to end up with items I may not need.
Love shopping Walmart and the delivery in home feature.,The replenishment automatically adds what I usually order and helps me greatly so that I don't forget to add those items.  It's great because it's saves me time in having to run and pick up things that I forgot to order.,Very Disappointed,Saves me time.,"It saves you time on the mundane, so you have time for the fun stuff.",I believe it's very helpful.,Creating and controlling my own Replenishment list,I like being able to review and add additional items that come up so that those items can be delivered at the same time.
N/a,Makes shopping faster,Slightly Disappointed,Saving time by not having to add items to your cart,"The ability to easily make changes to your picks, so you're in control of what you buy.",N/a,Suggestions for new products we think your family might like,"If we don’t need an item, I want to be able to remove it and ensure that I will be here at the delivery time"
"I am super happy with the pickup and delivery options. I love the InHome upgrade. I have found that many items are cheaper through Kroger delivery, but I know that's not what you're trying to learn about with this pilot. If Walmart offers price matching on grocery items, it would be nice to have a way to submit a price match request in app.     I also wish the app would easily let me add funds to an existing gift card. It's a convenient way to budget my groceries, but I don't like that I have to buy a new e-gift card. I'd love to be able to easily just top up the funds on an existing gift card that's in my Walmart Wallet.","I had to really pay attention to quantities. Some things it added multiples of and then I'd end up with 2+ of something I didn't need that many. It's very convenient and I love the idea of it, but maybe create an interface that makes it more intuitive to check quantities. An even better feature would be algorithm based where it could figure out how often I buy a certain product and only add that to my replenishment that often, so if on average I buy a product every 5 weeks then it would only be added to my cart every 5 weeks.",No Reaction,It's just a time saver. There are certain items that I buy with just about every order so it was nice to already have those in my cart.,"It saves you time on the mundane, so you have time for the fun stuff.","None, I covered it all. An algorithm based replenishment for items not purchased weekly would be nice.",Suggestions for how I can save by buying in bulk or switching brands,Auto delivery would be very inconvenient for me. It would just be something I'd have to remember to check every week. Sometimes I'm out of town or not at home or don't need certain things and I'd hate if they just automatically showed up. A couple years ago I didn't pay attention to my Amazon Subscribe and Save for a few months and I ended up with WAY too many of certain products because I forgot to skip those for the month.
N/A,It makes it easier each week to figure out groceries for the following week,Moderately Dissapointed,Easier to remember the groceries that we always buy for the family,"It saves you time on the mundane, so you have time for the fun stuff.",Consider the frequency in which items are purchased,Pairing recipes with product suggestions,I travel infrequently
No,All but one item were accurate. It would be nice to have a replenish button in lieu of auto replenishment. That way I could choose when I wanted to autofill my cart.,Slightly Disappointed,It’s nice to have the usual items already loaded so I don’t have to search for them.,"The ability to easily make changes to your picks, so you're in control of what you buy.",I order groceries more than once a week so I don’t always need or want to wait for a replenishment on Tuesdays.,Creating and controlling my own Replenishment list,I like to be in control of what where and when.
N/A,Accuracy was good enough but can be improved. Add only those items which user will buy anyway because users hate remove items from,Slightly Disappointed,I shop regularly and I like to have my cart prefilled with regular items so I spend less time adding them.,"It saves you time on the mundane, so you have time for the fun stuff.","I would say this is solid feature. I would improve accuracy of picks further, analyze patterns, apply machine learning.   One of the idea is to see list of replenishments with rules and be able modify them - just an idea. For example: blueberries, 2 count, every two weeks - modify or delete this rule.",Pre-booked delivery time,"I’m worried about accuracy at this point. I would like to have more experience with this feature to believe in picks it is doing.  I would suggest having settings - some users will choose auto delivery and some not, I would really like to have InHome delivery slots booking because sometime I forget to do it."
"This was an exciting program to be a part of, thank you!",I love that the items I usually order are already in my cart! It makes shopping even easier,Very Disappointed,I don’t forget items that I need and it helps me stay stocked on my go to items,"The ability to easily make changes to your picks, so you're in control of what you buy.","I would love to start with a replenishment list, then have it ask me to add items that frequently are in my cart",Creating and controlling my own Replenishment list,I don’t like auto delivery because sometimes I forget and spend money I shouldn’t. I like replenishment because it adds things to my cart and they don’t show up until I do my actual order and I can double check everything
No,Make it to where we can remove items from the list and add them,No Reaction,None,"The ability to easily make changes to your picks, so you're in control of what you buy.",None,Creating and controlling my own Replenishment list,Don’t care
Keep innovating! I think the future is bright for this feature,So far replenishment has been a great experience and cut down on the amount of time needed to add some items. I think it would be good to have an option to set replenishment favorites so that things you must have are always included in each order.     This would make sure that my priority replenishment items are never missed.,Slightly Disappointed,The main benefit is the time savings that replenishment offers when creating an order. Having most of your items already included in the cart saves from the headache of searching for multiple grocery items.,"The ability to have a ""second you"" that knows what you need.",1. Option to add replenishment favorites;     2. The option to add a replenishment frequency for individual items. I’ve found that sometimes replenishment has added items for my weekly frequency but some items could be added every two weeks or monthly depending on how fast the household consumes those items.     3. Nothing else. Keep up the good work!,Suggestions for how I can save by buying in bulk or switching brands,"I think auto delivery would be very beneficially and improve my experience greatly. It was my first selected choice but I changed my choice as I would rather prioritize saving money over auto delivery. Since I have a schedule/routine of when to order my groceries, auto delivery is not as important as being able to have replenishment save me money or suggest how to save money by comparing/switching brands."
N/A,It makes one stop shopping easier for weekly family needs. I know where I will be a customer for life.,Very Disappointed,"It already has the items you need to restock in the cart. It remembers the brand, type and most important quantity","It saves you time on the mundane, so you have time for the fun stuff.",I wish there was an option for every other week on like eggs and bread. Otherwise it is a very simple procedure,Pairing recipes with product suggestions,Sometimes you are still good on some items and I wouldn’t want to waste what we wouldn’t need at the time.
Great work!!,Replenishment has been a huge time saver! It's easy to start with the items it adds every week and then add/prune stuff from there.,Very Disappointed,"It saves me 15min a week picking out items I usually buy every week, which is huge given my free time is limited with young kids. It also makes ordering more convenient.","It saves you time on the mundane, so you have time for the fun stuff.",It would be nice to be able to add or remove things from Replenishment manually.,Creating and controlling my own Replenishment list,I like to have control over when I get my groceries.
Thank you for letting us participate.,Made ordering easier and faster.,Very Disappointed,Saves time,"The ability to have a ""second you"" that knows what you need.",Please make available as soon as possible,Creating and controlling my own Replenishment list,I don’t like auto delivery as we have 5 kids and what they eat can vary on a weekly basis.
N/A,Make the replenishment experience more like a subscription service where you can specify how often you would like to receive each individual item.,Slightly Disappointed,"The main benefit was that I didn't need to add the items that I typically purchased to the cart, they were already there waiting for me.","The ability to easily make changes to your picks, so you're in control of what you buy.","Replenishment is a great idea, although slightly clunky. I would like the ability to specify how often I would like to purchase each individual item. For instance, I would like apples every other week.",Automatic delivery of my Replenishment items,N/A
Nothing further at this time.,Just be sure that the technology kinks are worked out. It seems to be working properly now. I just hope it keeps like that.,Very Disappointed,"The cart is filled and if I do not need the item, I can simply remove it.","The ability to easily make changes to your picks, so you're in control of what you buy.",Aside from the technology glitches it seems like this program will be value-added in my life.,Creating and controlling my own Replenishment list,Sometimes I do not want all the items in the replenishment. I do not want to pay for something I already have too much of.
N/A,I am not sure if the quantities were correct,No Reaction,Saves time,"The ability to easily make changes to your picks, so you're in control of what you buy.",I think you got the right products but the quantities were wrong,Automatic delivery of my Replenishment items,N/A
No,Helpful with my weekly grocery shopping for recurring items,Moderately Dissapointed,Streamlines weekly grocery shopping,"It saves you time on the mundane, so you have time for the fun stuff.",it would be good if replenishment added more items or made new product suggestions,Suggestions for how I can save by buying in bulk or switching brands,Auto delivery would be helpful if there were a savings associated
No thanks,I don’t buy the same thing each week so when the order is preloaded I had to go in and delete so it didn’t really save me  time . I prefer to use “my items”,No Reaction,I didn’t find any mostly bc I feel like the app is already easy,None of the above,I do always choose the same time slip each week and I don’t think replenish picked up on that,Pre-booked delivery time,I read that wrong I would like auto delivery
no the service is great,Saves Time,Moderately Dissapointed,easy to use,"The ability to easily make changes to your picks, so you're in control of what you buy.",i dont know how to update my list and add new items to it,Suggestions for how I can save by buying in bulk or switching brands,i still can do it through the app
Thank you! It was great,"I often find myself shopping “my items” on the Walmart app. This section should be “replenishment” and the items should be auto added to my cart, and I can go in that section to remove or add more.",Slightly Disappointed,Sometime I forget to order some regular items in our household. I have to “add to order” regularly. But replenishment has helped me remember the easy to forget things like toddler snacks and butter.,"It saves you time on the mundane, so you have time for the fun stuff.","It would be cool to have subscription program as well and save money, similar to amazons subscribe and save.",Suggestions for how I can save by buying in bulk or switching brands,"It would improve my experience if there was an associated discount with a subscription order, similar to amazons subscribe and save"
Nothing further.,"Some of the items that were being replenished were items that had not been ordered. Specifically, one item that kept getting replenished was a kind of coffee that did not match what was regularly ordered.",Slightly Disappointed,Saves time,"It saves you time on the mundane, so you have time for the fun stuff.","Not sure how feasible, but perhaps analyzing the frequency of how often items are ordered, so that something that typically only gets ordered once a month doesn't show up in the cart every week.",Suggestions for how I can save by buying in bulk or switching brands,I like to have final say in what gets ordered and when. Life is too fluid to jump into an automatic schedule for groceries.
"I hope you keep this feature.   I get that it’s similar to autoship and the differences are nuanced, but it is truly a better approach.   I hope you’re able to market and launch it in a way that brings you success.",Replenishment is the online shopping idea I have been waiting for.  It is the perfect blend of ai/technology and personal input.   I really appreciated how easy it made making my weekly shopping.,Very Disappointed,"Flexible collaboration.   Unlike auto subscriptions, replenishment gives you the flexibility to add or subtract to your order, adjusting for that week’s unique circumstances.   It starts your cart for you, but gives you the flexibility to make any adjustments necessary.","The ability to have a ""second you"" that knows what you need.",As the program progressed it seems the system got better at putting more items in the cart.   That was a major improvement.  Getting more suggestions was certainly better and added more value to the service than when I only received a handful of replenishment items.       One thought would be to be able to manually add a check mark next to an item to have it always be included in replenishment (even if it had not been ordered before).   Yet another angle on the flexible collaboration that makes replenishment a better service!,Creating and controlling my own Replenishment list,"My circumstances change.  I may have ordered too little or too much previously and prefer the flexibility of being able to collaborate on my order instead of autoship.      Most importantly, in order to not over order, I will ALWAYS limit what I auto ship."
"Overall the service is cool. For me it would not be beneficial if it’s an added expense, unless it would be bundled with the two services I already pay for.","The service is good in theory, but not good enough for an added expense. As I stated previously I would prefer to have my cart filled with more item, and remove them rather then searching and adding items I may need. After weeks of use, it’s not beneficial week after week. It added a few items but not enough.",No Reaction,"The main benefit is it added the main items for the most part, but not all the things I regularly pirchase","It saves you time on the mundane, so you have time for the fun stuff.","Overall I like the concept,  but I have not been able to just check out. I prefer to not have to search. Some things I buy weekly, or biweekly. Maybe the system can detect that.",Creating and controlling my own Replenishment list,"It would not improve because some of the items added I absolutely did not need. I buy coffee creamer and coffee regularly, and they were not added. I buy paper plates regularly, the same brand, and they were not added. I would end up still having to place another order. I would be open if I’m able to select my replenish items on a schedule as well as the items Walmart picks."
N/A,It was confusing as how to add or takeaway what replenishing items were created,Slightly Disappointed,It made it quicker to checkout,"The ability to easily make changes to your picks, so you're in control of what you buy.",Removal of repeat items,Automatic delivery of my Replenishment items,N/A
"Shipt allows customers to leave small notes for items they are having delivered. For example, I want my bananas more green/yellow, or I want my avocado firm/semi-soft. It was a very useful feature and it would be great if Walmart adds a same feature.","It auto populates my go to items. It does the work for me, and all I have to do is edit and check out. It saves me time and reminds me what I need.",Slightly Disappointed,"Being reminded to order groceries, being reminded what items I probably need, and it’s faster to edit rather than starting from scratch.","The ability to easily make changes to your picks, so you're in control of what you buy.",I wish it gave me the option to pick what day of the week I wanted it to populate my cart.,Suggestions for how I can save by buying in bulk or switching brands,I don’t need the same items and I don’t need them on any regular schedule. Things change all the time and I need to be able to have control over this.
Thank you for doing a pilot instead of just thrusting new things out without customer feedback,Put the same variety packs that I normally order instead of just a random variety pack from that brand.,Moderately Dissapointed,I don’t have to constantly add my go-to items. I can just add on specialty items,"It saves you time on the mundane, so you have time for the fun stuff.",Maybe a section for suggestions similar to your replenishment picks.,Suggestions for how I can save by buying in bulk or switching brands,I don’t always have the same schedule so I have to book deliveries differently throughout the week/month.
Nope,Would like to be able to set when replenishment picks come in,No Reaction,I didn’t experience benefit,None of the above,Would like it to focus on toiletries and household essentials rather than food,Creating and controlling my own Replenishment list,I would get things I did not need
N/A,Nothing that I can think of.,Moderately Dissapointed,It helped me remember to get the staple items that I was used to having in my pantry and I was more likely to forget.,"The ability to have a ""second you"" that knows what you need.",I don’t have any recommendations.,Setting my substitutions,"I don’t always need the replenishment items, so I like being able to control when I get my order."
Nope I think everything was covered,Improve the algorithms,No Reaction,Adding things to my cart that I might forget,"The ability to easily make changes to your picks, so you're in control of what you buy.",Maybe making recommendations based on past purchases,Pre-booked delivery time,"Because I may not need these items, and it would be a waste of my money. If things were being auto delivered, I would not sign up for the program"
Nope,A wider variety of suggestions based on past purchases. It seemed like it was the same 5 items every week. I would also suggest more items suggested every week…maybe 7-10.,No Reaction,A few times it was a good reminder that I needed something I often buy but forgot.,"The ability to have a ""second you"" that knows what you need.","Quantity of items suggested was always on point with what I’d usually but. I think it would be cool to see maybe similar items from a different brand or different flavor as a “consider this” or “if you like this product you may like this other product”” type of option. It would be cool to try new things based on what I usually buy. Or items that would compliment my usual purchases well..like, “we noticed you often buy apples, have you ever tried this caramel dip to go with them?”",Suggestions for how I can save by buying in bulk or switching brands,I wouldn’t want more of something if I didn’t need it.
N/A,Frequently purchased items were already in cart to check out.  I didn’t have to search through all of my past items to compile a weekly shopping list. Very convenient.,Moderately Dissapointed,Spending less time searching for frequently purchased items.,"It saves you time on the mundane, so you have time for the fun stuff.",N/A,Suggestions for new products we think your family might like,My pay periods are irregular so I like to control when I actually make purchases.
This was really fun and I appreciate the opportunity to try out a new service!,"I think that the Replenishment program is fine and saves time adding standard items to the cart each week. It didn't do a good job with items that were ordered less frequently (for example, we order a big tub of ground coffee every few weeks). Additionally, having a way to ""pause"" the service when going out of town would be helpful",Moderately Dissapointed,Time saved adding items (and the quantity of items) that are ordered every week,"It saves you time on the mundane, so you have time for the fun stuff.","1. Items that I don't order weekly, but do order regularly (like every 2 weeks or monthly items) were not included but those are the items I am more likely to forget shopping on my own. That would be my biggest suggestion!  2. Maybe a way to preview or remove an item that is no longer ordered. I go through phases where a snack item is ordered weekly, but then I get bored with it and stop ordering it. It will still show up in the replenishment list weeks after I last ordered",Creating and controlling my own Replenishment list,I have had some issues with quantity of items being more than I need in a week so I wouldn't want to end up with 4 lbs of strawberries auto delivered to my home.   And items that are no longer ordered remain in the replenishment list after I no longer use them.   I do use Amazon Subscribe and Save and like it because it offers a discount for subscription items. I probably would not sign up for an auto delivery without a cost incentive.
I’ve been very pleased with the Walmart delivery service and the money and time it saves me. Thank you!! I appreciate the replenish service as well!,I’d love the option of what day the replenished items appear in my cart. Tuesday is early in the week because I usually order groceries on Sundays.,Very Disappointed,I reorder the same things weekly for the most part so it makes it much faster and I’m always looking for ways to save time!,"It saves you time on the mundane, so you have time for the fun stuff.",I appreciate being able to modify the order!,Pre-booked delivery time,I sometimes need to modify the time based on activities and like to be here when the food arrives.
It was great!  thank you.  I hope it continues,"It made shopping easier.  I would like to be able to pick what day of the week the replenishment could load.  other than that, it was great!",Moderately Dissapointed,makes shopping easier,"It saves you time on the mundane, so you have time for the fun stuff.",i would like to be able to pick the day of the week that the replenishment is added to my cart,Creating and controlling my own Replenishment list,i would like to control when items are delievered
Nothing further.,Convenient in terms of adding my frequent items to the cart automatically.,Moderately Dissapointed,Time saver.,"The ability to have a ""second you"" that knows what you need.","It was a little wonky during the first few weeks, but seemed to get more reliable over the last month or so.",Suggestions for new products we think your family might like,Our family's schedule isn't always the same.  I can't commit to the same time each week.
